"Status","Start Time","Stop Time","Duration in ms","Parent Suite","Suite","Sub Suite","Test Class","Test Method","Name","Description"
"passed","Fri Apr 26 13:58:33 GMT 2024","Fri Apr 26 13:58:45 GMT 2024","11380","","Tests","","","","Check Available Bike Count Matchec Between UI And API","Reads bike count for specific bike station from the API and UI
and checks that bike count matches between UI and API."
"passed","Fri Apr 26 13:58:45 GMT 2024","Fri Apr 26 13:58:48 GMT 2024","2973","","Tests","","","","Search Routes And Check Same Routes Can Be Found From UI And API","Search routes from API and UI with specific name and
check that results matches."
"passed","Fri Apr 26 13:58:48 GMT 2024","Fri Apr 26 13:58:48 GMT 2024","4","","Tests","","","","Flaky Tests Which Sometimes Passes And Sometimes Fails","Just for demonstration purposes"
